Name,Office,DistrictType,District,Party,Incumbent,Status,PhotoURL,Bio,Website,OfficialURL,Email,Phone,Facebook,Instagram,X,VolunteerURL,DonateURL,TopIssues,Active,Order
Maria Chen,U.S. House District 2,congress,2,Democratic,FALSE,GENERAL,,"Veteran and engineer running to expand rural broadband.",https://mariachen.example,,maria@example.com,801-555-0140,,,@mariachenUT,https://mariachen.example/volunteer,https://mariachen.example/donate,"Economy, Healthcare",TRUE,1
Bob Lee,State Senate District 5,senate,5,Republican,TRUE,GENERAL,,"Small-business owner running to protect public lands.",https://boblee.example,https://senate.utah.gov/sen/BOBLEE/,,,,https://instagram.com/bobleeUT,,https://boblee.example/volunteer,,"Environment, Economy",TRUE,1
Jane Smith,State House District 10,house,10,Democratic,TRUE,GENERAL,,"Teacher and community advocate focused on public schools.",https://janesmith.example,https://house.utleg.gov/rep/JANESM/,jane@example.com,801-555-0100,https://facebook.com/janesmithUT,,@janesmithUT,https://janesmith.example/volunteer,https://janesmith.example/donate,"Education, Housing, Healthcare",TRUE,1
Sam Rivera,State School Board District 7,school_board,7,Republican,FALSE,GENERAL,,"Parent and PTA leader focused on classroom funding.",https://samrivera.example,,sam@example.com,,,,@samriveraUT,https://samrivera.example/volunteer,,"Education, Voting Rights",TRUE,1
Dana Wong,Local School Board,school_district,Granite,,FALSE,GENERAL,,"Longtime educator running for the Granite district board.",https://danawong.example,,dana@example.com,,,https://instagram.com/danawongUT,,https://danawong.example/volunteer,,"Education",TRUE,1
Pat Morales,County Sheriff,county,Salt Lake,Republican,TRUE,GENERAL,,"Career law-enforcement officer seeking a second term as county sheriff.",https://patmorales.example,,,,,@patmoralesUT,,,"Public Safety",TRUE,1
